{
  "schema": "e2er-research-object/0.1",
  "id": "bhanneke/spot-bitcoin-etf-comovement",
  "content_id": "sha256:b984c9649e773346e57675910ec16c2312a2a2a2a8edfa18a5da7ad520160938",
  "title": "No Cash Flows, New Owners: Spot Bitcoin ETFs and the Origins of Co-movement",
  "question": "Did the January 2024 approval of US spot Bitcoin ETFs change the co-movement between Bitcoin returns and US equity returns?",
  "contributors": [
    {
      "name": "Björn Hanneke",
      "github": "bhanneke",
      "orcid": "0009-0000-7466-9581",
      "roles": [
        "conceptualization",
        "investigation"
      ]
    }
  ],
  "ai": {
    "backend": "claude_code",
    "model": "claude-sonnet-4-5",
    "agents": [
      "idea_developer",
      "literature_scanner",
      "identification_strategist",
      "data_architect",
      "data_analyst",
      "econometrics_specialist",
      "paper_drafter",
      "abstract_writer",
      "mechanism_reviewer",
      "technical_reviewer",
      "literature_reviewer",
      "writing_reviewer",
      "data_reviewer",
      "identification_reviewer",
      "patch_revisor",
      "replication_packager"
    ],
    "agents_source": "recorded",
    "usage": [
      {
        "agent": "strategist:decide",
        "backend": "claude_code",
        "model": "claude-sonnet-4-5",
        "calls": 1,
        "input_tokens": 2,
        "output_tokens": 4450,
        "cache_read_tokens": 11688,
        "cache_write_tokens": 11156,
        "cost_usd": 0.0,
        "first": "2026-09-11 09:48:20",
        "last": "2026-09-11 09:48:20"
      },
      {
        "agent": "idea_developer",
        "backend": "claude_code",
        "model": "claude-sonnet-4-5",
        "calls": 1,
        "input_tokens": 12,
        "output_tokens": 28991,
        "cache_read_tokens": 168275,
        "cache_write_tokens": 49501,
        "cost_usd": 0.0,
        "first": "2026-09-11 09:50:45",
        "last": "2026-09-11 09:50:45"
      },
      {
        "agent": "literature_scanner",
        "backend": "claude_code",
        "model": "claude-sonnet-4-5",
        "calls": 1,
        "input_tokens": 50,
        "output_tokens": 47785,
        "cache_read_tokens": 1508224,
        "cache_write_tokens": 101662,
        "cost_usd": 0.0,
        "first": "2026-09-11 09:55:26",
        "last": "2026-09-11 09:55:26"
      },
      {
        "agent": "identification_strategist",
        "backend": "claude_code",
        "model": "claude-sonnet-4-5",
        "calls": 1,
        "input_tokens": 12,
        "output_tokens": 31778,
        "cache_read_tokens": 253328,
        "cache_write_tokens": 66060,
        "cost_usd": 0.0,
        "first": "2026-09-11 09:58:02",
        "last": "2026-09-11 09:58:02"
      },
      {
        "agent": "data_architect",
        "backend": "claude_code",
        "model": "claude-sonnet-4-5",
        "calls": 1,
        "input_tokens": 30,
        "output_tokens": 53480,
        "cache_read_tokens": 818909,
        "cache_write_tokens": 101835,
        "cost_usd": 0.0,
        "first": "2026-09-11 10:02:15",
        "last": "2026-09-11 10:02:15"
      },
      {
        "agent": "data_analyst",
        "backend": "claude_code",
        "model": "claude-sonnet-4-5",
        "calls": 1,
        "input_tokens": 74,
        "output_tokens": 66586,
        "cache_read_tokens": 4352669,
        "cache_write_tokens": 149925,
        "cost_usd": 0.0,
        "first": "2026-09-11 10:08:09",
        "last": "2026-09-11 10:08:09"
      },
      {
        "agent": "econometrics_specialist",
        "backend": "claude_code",
        "model": "claude-sonnet-4-5",
        "calls": 1,
        "input_tokens": 86,
        "output_tokens": 154967,
        "cache_read_tokens": 6629813,
        "cache_write_tokens": 228019,
        "cost_usd": 0.0,
        "first": "2026-09-11 10:18:38",
        "last": "2026-09-11 10:18:38"
      },
      {
        "agent": "paper_drafter",
        "backend": "claude_code",
        "model": "claude-sonnet-4-5",
        "calls": 2,
        "input_tokens": 136,
        "output_tokens": 147970,
        "cache_read_tokens": 8845574,
        "cache_write_tokens": 383652,
        "cost_usd": 0.0,
        "first": "2026-09-11 10:27:00",
        "last": "2026-09-11 10:29:22"
      },
      {
        "agent": "abstract_writer",
        "backend": "claude_code",
        "model": "claude-sonnet-4-5",
        "calls": 1,
        "input_tokens": 14,
        "output_tokens": 13248,
        "cache_read_tokens": 431143,
        "cache_write_tokens": 83001,
        "cost_usd": 0.0,
        "first": "2026-09-11 10:28:02",
        "last": "2026-09-11 10:28:02"
      },
      {
        "agent": "mechanism_reviewer",
        "backend": "claude_code",
        "model": "claude-sonnet-4-5",
        "calls": 1,
        "input_tokens": 4,
        "output_tokens": 17513,
        "cache_read_tokens": 214566,
        "cache_write_tokens": 202686,
        "cost_usd": 0.0,
        "first": "2026-09-11 10:31:03",
        "last": "2026-09-11 10:31:03"
      },
      {
        "agent": "technical_reviewer",
        "backend": "claude_code",
        "model": "claude-sonnet-4-5",
        "calls": 1,
        "input_tokens": 4,
        "output_tokens": 63237,
        "cache_read_tokens": 213640,
        "cache_write_tokens": 248166,
        "cost_usd": 0.0,
        "first": "2026-09-11 10:35:41",
        "last": "2026-09-11 10:35:41"
      },
      {
        "agent": "literature_reviewer",
        "backend": "claude_code",
        "model": "claude-sonnet-4-5",
        "calls": 1,
        "input_tokens": 4,
        "output_tokens": 21075,
        "cache_read_tokens": 210695,
        "cache_write_tokens": 202977,
        "cost_usd": 0.0,
        "first": "2026-09-11 10:37:27",
        "last": "2026-09-11 10:37:27"
      },
      {
        "agent": "writing_reviewer",
        "backend": "claude_code",
        "model": "claude-sonnet-4-5",
        "calls": 1,
        "input_tokens": 4,
        "output_tokens": 49246,
        "cache_read_tokens": 213424,
        "cache_write_tokens": 234580,
        "cost_usd": 0.0,
        "first": "2026-09-11 10:41:02",
        "last": "2026-09-11 10:41:02"
      },
      {
        "agent": "data_reviewer",
        "backend": "claude_code",
        "model": "claude-sonnet-4-5",
        "calls": 1,
        "input_tokens": 20,
        "output_tokens": 46847,
        "cache_read_tokens": 2039989,
        "cache_write_tokens": 240534,
        "cost_usd": 0.0,
        "first": "2026-09-11 10:44:43",
        "last": "2026-09-11 10:44:43"
      },
      {
        "agent": "identification_reviewer",
        "backend": "claude_code",
        "model": "claude-sonnet-4-5",
        "calls": 1,
        "input_tokens": 4,
        "output_tokens": 43353,
        "cache_read_tokens": 215770,
        "cache_write_tokens": 230414,
        "cost_usd": 0.0,
        "first": "2026-09-11 10:48:14",
        "last": "2026-09-11 10:48:14"
      },
      {
        "agent": "patch_revisor",
        "backend": "claude_code",
        "model": "claude-sonnet-4-5",
        "calls": 1,
        "input_tokens": 36,
        "output_tokens": 41272,
        "cache_read_tokens": 1516302,
        "cache_write_tokens": 128127,
        "cost_usd": 0.0,
        "first": "2026-09-11 10:51:38",
        "last": "2026-09-11 10:51:38"
      },
      {
        "agent": "replication_packager",
        "backend": "claude_code",
        "model": "claude-sonnet-4-5",
        "calls": 1,
        "input_tokens": 30,
        "output_tokens": 68007,
        "cache_read_tokens": 1386761,
        "cache_write_tokens": 174583,
        "cost_usd": 0.0,
        "first": "2026-09-11 10:55:37",
        "last": "2026-09-11 10:55:37"
      }
    ]
  },
  "process": {
    "template": "empirical",
    "mode": "single_pass",
    "methodology": "empirical",
    "governance": "full",
    "e2er_version": "0.13.6",
    "exported": "20261005"
  },
  "components": {
    "skills": {
      "idea_developer": [
        "base/researcher",
        "base/economist",
        "reasoning/creative-ideation",
        "reasoning/novelty"
      ],
      "literature_scanner": [
        "base/researcher",
        "synthesis/context-builder"
      ],
      "identification_strategist": [
        "causal-inference/judge-designs",
        "causal-inference/natural-experiments",
        "reasoning/identification",
        "causal-inference/identification-spec-schema"
      ],
      "data_architect": [
        "data/query-data",
        "data/blockchain",
        "data/crypto-defi",
        "base/economist",
        "data/allium-cli",
        "data/allium-developer-api",
        "data/yfinance",
        "data/fred"
      ],
      "data_analyst": [
        "data/query-data",
        "data/cleaning",
        "data/figure-spec",
        "econometrics/panel-data",
        "data/allium-cli",
        "data/allium-developer-api",
        "data/yfinance",
        "data/fred",
        "data/summary-statistics-schema"
      ],
      "econometrics_specialist": [
        "data/query-data",
        "econometrics/iv-estimation",
        "econometrics/did",
        "econometrics/panel-data",
        "econometrics/event-study",
        "econometrics/estimation-results-schema"
      ],
      "paper_drafter": [
        "writing/paper-structure",
        "writing/personal-style",
        "base/researcher",
        "writing/cite-numbers-by-source",
        "data/table-spec"
      ],
      "abstract_writer": [
        "writing/abstract",
        "reasoning/anti-slop",
        "writing/cite-numbers-by-source"
      ],
      "mechanism_reviewer": [
        "review/referee-simulation",
        "modeling/market-microstructure"
      ],
      "technical_reviewer": [
        "review/technical-review",
        "review/consistency-check"
      ],
      "literature_reviewer": [
        "review/referee-simulation",
        "synthesis/context-builder"
      ],
      "writing_reviewer": [